{
  "schema_version": "1.0",
  "path": "runs/2026-10-15_recipe/normalized.mp4",
  "url": "https://www.youtube.com/watch?v=demo",
  "sha256": "9a1f2c3d4e5f60718293a4b5c6d7e8f90a1b2c3d4e5f60718293a4b5c6d7e8f9",
  "duration_s": 840.5,
  "fps": 29.97,
  "width": 1920,
  "height": 1080,
  "streams": [
    { "index": 0, "type": "video", "codec": "h264" },
    { "index": 1, "type": "audio", "codec": "aac", "language": "ru" }
  ]
}
